{
  "schema_version": "piotw-company-intelligence-v0.1",
  "company": {
    "company_id": "cloudflare",
    "display_name": "Cloudflare",
    "legal_name": null,
    "ticker": null,
    "geography": null,
    "activity": null
  },
  "as_of": "2026-08-19T00:00:00Z",
  "generated_at": "2026-08-19T00:00:00Z",
  "methodology_version": "unknown-company-orchestrator-v0.1",
  "scientific_gate_run": false,
  "coverage": {
    "status": "LOW",
    "source_families_present": [
      "careers_ats"
    ],
    "source_families_missing": [
      "contracts_procurement",
      "issuer_disclosures",
      "regulatory_operating_notices"
    ],
    "evidence_count": 2,
    "provenance_complete": true,
    "caveats": [
      "No approved supplier-to-company entity match exists for this run.",
      "No company-agnostic approved issuer collector is wired to this orchestrator.",
      "Feasibility is documented, but no approved production collector is wired."
    ]
  },
  "evidence": [
    {
      "evidence_id": "ev-80388569f44c4823ce934a51",
      "source_id": "80388569f44c4823ce934a51",
      "title": "Careers snapshot — 2026-08-15T17:01:34.918831+00:00",
      "source_family": "careers_ats",
      "source_url": "https://boards.greenhouse.io/cloudflare",
      "source_hash": "58a49813d14a2f87ed4ab6c06f813ccb4d9ef5e0b4720a1976255a3351d91292",
      "publication_date": "2026-08-15",
      "information_available_at": "2026-08-15T17:01:34.918831Z",
      "entity_scope": "cloudflare",
      "evidence_span": "Approved careers collector observed 305 open postings for Cloudflare.",
      "collector_or_parser_version": "careers-longitudinal-v1"
    },
    {
      "evidence_id": "ev-4bdf0bc59fc462b70a06a2d7",
      "source_id": "4bdf0bc59fc462b70a06a2d7",
      "title": "Careers snapshot — 2026-08-17T21:23:38.215420+00:00",
      "source_family": "careers_ats",
      "source_url": "https://boards.greenhouse.io/cloudflare",
      "source_hash": "7965f9e124259afc61cf5a164bb121d4987ceaaba2b817e9678abc031d58aa4c",
      "publication_date": "2026-08-17",
      "information_available_at": "2026-08-17T21:23:38.215420Z",
      "entity_scope": "cloudflare",
      "evidence_span": "Approved careers collector observed 297 open postings for Cloudflare.",
      "collector_or_parser_version": "careers-longitudinal-v1"
    }
  ],
  "conditions": [
    {
      "condition_id": "condition-careers-vacancy-state",
      "title": "Careers vacancy state — factual only",
      "statement": "The approved careers collector observed 297 open postings at the latest cutoff-safe snapshot. The prior stored snapshot observed 305; the deterministic difference is -8.",
      "dimension": "Workforce & Capability",
      "direction": "UNKNOWN",
      "materiality": "UNKNOWN",
      "evidence_confidence": "HIGH",
      "state": "297 open postings",
      "change": "-8 postings",
      "evidence_ids": [
        "ev-80388569f44c4823ce934a51",
        "ev-4bdf0bc59fc462b70a06a2d7"
      ],
      "caveats": [
        "Vacancy-count movement is not interpreted as growth, contraction, pressure or health.",
        "Two snapshots are insufficient to establish a material operational condition."
      ]
    }
  ],
  "comparisons": [
    {
      "comparison_id": "comparison-careers-state",
      "condition_id": "condition-careers-vacancy-state",
      "status": "INSUFFICIENT_EVIDENCE",
      "basis": "PEER_AND_HISTORY",
      "metric": "Open-vacancy movement",
      "target_value": null,
      "comparator_value": null,
      "gap": null,
      "unit": null,
      "percentile": null,
      "sample_size": null,
      "peer_set_or_history": null,
      "method": null,
      "confidence": "NOT_ASSESSED",
      "evidence_ids": [],
      "caveats": [],
      "withheld_reason": "Only one or two early snapshots exist and no approved size/coverage-normalised peer benchmark is available."
    }
  ],
  "predictions": [
    {
      "prediction_id": "prediction-unknown-company",
      "status": "NOT_BUILT",
      "target_event": null,
      "horizon": null,
      "probability": null,
      "confidence": "NOT_ASSESSED",
      "model_version": null,
      "historical_pattern": null,
      "supporting_condition_ids": [],
      "evidence_ids": [],
      "caveats": [],
      "withheld_reason": "No validated operational predictive-pattern engine is available."
    }
  ],
  "interventions": [
    {
      "intervention_id": "intervention-unknown-company",
      "status": "WITHHELD",
      "title": null,
      "mechanism": null,
      "investigation_steps": [],
      "supporting_condition_ids": [],
      "evidence_ids": [],
      "evidence_strength": "NOT_ASSESSED",
      "falsifiers": [],
      "caveats": [],
      "withheld_reason": "A factual vacancy count alone does not support a driver-specific intervention."
    }
  ],
  "financial_impacts": [
    {
      "impact_id": "impact-unknown-company",
      "intervention_id": "intervention-unknown-company",
      "status": "WITHHELD",
      "mechanism": null,
      "measure": null,
      "low": null,
      "base": null,
      "high": null,
      "currency": null,
      "unit": null,
      "period": null,
      "incremental": null,
      "assumptions": [],
      "evidence_ids": [],
      "caveats": [],
      "withheld_reason": "No evidence-backed intervention or financial mechanism is available."
    }
  ],
  "capabilities": {
    "detect": "INSUFFICIENT_EVIDENCE",
    "compare": "INSUFFICIENT_EVIDENCE",
    "predict": "NOT_BUILT",
    "prescribe": "WITHHELD",
    "quantify": "WITHHELD"
  },
  "missing_capabilities": [
    "Validated observation-to-operational-condition generation",
    "Coverage-normalised peer and historical benchmark",
    "Validated predictive-pattern engine",
    "Driver-specific intervention engine",
    "Evidence-backed financial mechanism"
  ],
  "overall_confidence": "LOW"
}
